tvo;num_voters;num_stations;description;city_neighborhood
182;159847;95;Центр: місто Херсон, Суворовський район;частина Дніпровського (виборчі дільниці № 650622 – 650653, 650662 – 650670), частина Суворовського (виборчі дільниці № 650726 – 650768, 650773 – 650782) районів міста Херсона з населеними пунктами Дніпровської та Суворовської районних у місті Херсоні рад
183;165996;108;Центр: місто Херсон, Комсомольський район;Комсомольський район, частина Дніпровського (виборчі дільниці № 650654 – 650661, 650671), частина Суворовського (виборчі дільниці № 650769 – 650772) районів міста Херсона з населеними пунктами Дніпровської, Суворовської та Комсомольської районних у місті Херсоні рад, Білозерський район.
184;173146;191;Центр: місто Нова Каховка;місто Нова Каховка з населеними пунктами Новокаховської міської ради, Бериславський, Великолепетиський, Великоолександрівський, Високопільський, Горностаївський, Нововоронцовський райони
185;174835;215;Центр: місто Каховка;місто Каховка, Верхньорогачицький, Генічеський, Іванівський, Каховський, Нижньосірогозький, Новотроїцький райони, частина Чаплинського району (виборчі дільниці № 650534 – 650538, 650544 – 650546, 650548, 650562, 650563).
186;177376;166;Центр: місто Цюрупинськ;місто Гола Пристань, Голопристанський, Каланчацький, Скадовський, Цюрупинський райони, частина Чаплинського району (виборчі дільниці № 650539, 650541 – 650543, 650547, 650549 – 650561)
187;143702;84;Центр: місто Хмельницький;частина міста Хмельницького (виборчі дільниці № 681455 – 681536, 681560)
188;147060;188;Центр: місто Хмельницький;частина міста Хмельницького (виборчі дільниці № 681427 –681454, 681559), Волочиський, Хмельницький райони
189;150565;285;Центр: місто Красилів;місто Нетішин, Білогірський, Ізяславський, Красилівський, Теофіпольський райони
190;151844;220;Центр: місто Шепетівка;міста Славута, Шепетівка, Полонський, Славутський, Шепетівський райони
191;139062;285;Центр: місто Старокостянтинів;місто Старокостянтинів, Віньковецький, Деражнянський, Летичівський, Старокостянтинівський, Старосинявський райони
192;151939;270;Центр: місто Дунаївці;Городоцький, Дунаєвецький, Чемеровецький, Ярмолинецький райони
193;154527;216;Центр: місто Кам’янець-Подільський;місто Кам’янець-Подільський, Кам’янець-Подільський, Новоушицький райони
194;145829;83;Центр: місто Черкаси, Придніпровський район;Придніпровський район, частина Соснівського району міста Черкас (виборчі дільниці № 711039 – 711042, 711044, 711049, 711080 –711100)
195;147391;160;Центр: місто Черкаси, Соснівський район;частина Соснівського району міста Черкас (виборчі дільниці № 711043, 711045 – 711048, 711050 – 711067, 711074 – 711079), Драбівський, Чигиринський, Чорнобаївський райони
196;148527;219;Центр: місто Корсунь-Шевченківський;Городищенський, Катеринопільський, Корсунь-Шевченківський, Шполянський райони, частина Канівського (виборчі дільниці № 710263, 710266, 710274, 710280 – 710285, 710287, 710289 –710291, 710298 – 710303), частина Лисянського (виборчі дільниці № 710403, 710404, 710411, 710412, 710420, 710421, 710433), частина Тальнівського (виборчі дільниці № 710563 – 710565, 710567, 710569 – 710579, 710582 –710585, 710587 – 710590, 710593 – 710597) районів
197;140604;146;Центр: місто Канів;міста Золотоноша, Канів, частина Соснівського району міста Черкас (виборчі дільниці № 711030 – 711038, 711068 – 711073), Золотоніський район, частина Канівського (виборчі дільниці № 710264, 710265, 710267 –710273, 710275 – 710279, 710286, 710288, 710292 – 710297, 710304 – 710309), частина Черкаського (виборчі дільниці № 710691, 710696, 710697, 710700, 710701, 710706, 710709, 710710, 710711 – 710713, 710716 – 710719, 710722 –710725, 710735, 710736) районів
198;143463;136;Центр: місто Сміла;місто Сміла, Кам’янський, Смілянський райони, частина Черкаського району (виборчі дільниці № 710690, 710692 – 710695, 710698, 710699, 710702 – 710705, 710707, 710708, 710714, 710715, 710720, 710721, 710726 – 710734, 710737)
199;141564;187;Центр: місто Жашків;місто Ватутіне, Жашківський, Звенигородський, Маньківський райони, частина Лисянського (виборчі дільниці № 710397 – 710402, 710405 –710410, 710413 – 710419, 710422 – 710432, 710434, 710435), частина Тальнівського (виборчі дільниці № 710548 – 710562, 710568, 710580, 710586, 710591, 710592) районів
200;156657;173;Центр: місто Умань;місто Умань, Монастирищенський, Уманський, Христинівський райони, частина Тальнівського району (виборчі дільниці № 710566, 710581)
201;172322;109;Центр: місто Чернівці, Шевченківський район;Першотравневий, Шевченківський райони, частина Садгірського району міста Чернівців (виборчі дільниці № 730480, 730487 –730492)
202;177370;166;Центр: місто Сторожинець;Вижницький, Кіцманський, Путильський райони, частина Сторожинецького району (виборчі дільниці № 730338 – 730351, 730355 –730361, 730364 – 730366, 730368 – 730375, 730378, 730381 – 730387, 730390 –730394)
203;175463;131;Центр: місто Новоселиця;частина Садгірського району міста Чернівців (виборчі дільниці № 730481 – 730486), Герцаївський, Глибоцький, Новоселицький райони, частина Сторожинецького району (виборчі дільниці № 730352 – 730354, 730362, 730363, 730367, 730376, 730377, 730379, 730380, 730388, 730389)
204;172220;155;Центр: місто Хотин;місто Новодністровськ, Заставнівський, Кельменецький, Сокирянський, Хотинський райони
205;146944;83;Центр: місто Чернігів, Деснянський район;Деснянський район, частина Новозаводського району міста Чернігова (виборчі дільниці № 741086, 741096 – 741099)
206;145675;175;Центр: місто Чернігів;частина Новозаводського району міста Чернігова (виборчі дільниці № 741061 – 741085, 741087 – 741095, 741100 – 741108), Ріпкинський, Чернігівський райони
207;139239;256;Центр: місто Корюківка;місто Новгород-Сіверський, Городнянський, Коропський, Корюківський, Новгород-Сіверський, Семенівський, Сосницький, Щорський райони
208;140152;202;Центр: місто Бахмач;Бахмацький, Борзнянський, Куликівський, Менський, Талалаївський райони, частина Ічнянського району (виборчі дільниці № 740197 – 740201, 740204, 740208, 740209, 740215, 740218, 740221, 740225, 740228, 740231, 740232, 740235, 740236, 740239, 740240)
209;141787;168;Центр: місто Ніжин;місто Ніжин, Варвинський, Ніжинський, Носівський, Срібнянський райони, частина Ічнянського району (виборчі дільниці № 740202, 740203, 740205 – 740207, 740210, 740212 – 740214, 740216, 740217, 740219, 740220, 740222 – 740224, 740226, 740227, 740229, 740230, 740233, 740234, 740237, 740238)
210;146912;219;Центр: місто Прилуки;місто Прилуки, Бобровицький, Козелецький, Прилуцький райони
211;170574;86;Центр: місто Київ, Голосіївський район;Голосіївський район міста Києва
212;177037;87;Центр: місто Київ, Дарницький район;частина Дарницького району міста Києва (виборчі дільниці № 800086 – 800156, 800205 – 800214, 801073, 801074, 801076 – 801078, 801082)
213;167985;76;Центр: місто Київ, Деснянський район;частина Деснянського району міста Києва (виборчі дільниці № 800215 – 800227, 800236 – 800243, 800254 – 800270, 800273 – 800304, 801068 – 801071, 801079, 801080)
214;162948;81;Центр: місто Київ, Дніпровський район;частина Дніпровського району міста Києва (виборчі дільниці № 800350 – 800353, 800366, 800369 – 800407, 800431 – 800434, 800438 – 800470)
215;166207;81;Центр: місто Київ, Деснянський район;частина Деснянського (виборчі дільниці № 800228 – 800235, 800244 – 800253, 800271, 800272, 800305 – 800341, 801072, 801081), частина Дніпровського (виборчі дільниці № 800342 – 800349, 800354 – 800365, 800367, 800368) районів міста Києва
216;159241;75;Центр: місто Київ, Дніпровський район;частина Дарницького (виборчі дільниці № 800157 – 800204, 801075), частина Дніпровського (виборчі дільниці № 800408 – 800430, 800435 –800437) районів міста Києва
217;167336;79;Центр: місто Київ, Оболонський район;частина Оболонського району міста Києва (виборчі дільниці № 800471 –800547, 800577, 800578)
218;149019;75;Центр: місто Київ, Святошинський район;частина Оболонського (виборчі дільниці № 800548 – 800576, 800579 – 800582), частина Святошинського (виборчі дільниці № 800781 –800822) районів міста Києва
219;165641;84;Центр: місто Київ, Святошинський район;частина Святошинського району міста Києва (виборчі дільниці № 800702 –800780, 800823 – 800827)
220;145430;72;Центр: місто Київ, Подільський район;Подільський район міста Києва
221;171779;105;Центр: місто Київ, Печерський район;Печерський район, частина Солом’янського (виборчі дільниці № 800828 – 800843, 800850, 800851, 800865, 800869 – 800871, 800873, 800877 – 800885, 800887 – 800891, 800950 – 800956, 800958, 801086), частина Шевченківського (виборчі дільниці № 800961 – 800964, 800966, 800967, 800975) районів міста Києва
222;171718;86;Центр: місто Київ, Солом’янський район;частина Солом’янського району міста Києва (виборчі дільниці № 800844 –800849, 800852 – 800864, 800866 – 800868, 800872, 800874 –800876, 800886, 800892 – 800949, 800957)
223;165791;101;Центр: місто Київ, Шевченківський район;частина Шевченківського району міста Києва (виборчі дільниці № 800965, 800968 – 800974, 800976 – 801066)
224;151528;95;Центр: місто Севастополь, Гагарінський район;Балаклавський район з населеними пунктами Балаклавської районної у місті Севастополі ради, Гагарінський район, частина Ленінського району міста Севастополя (виборчі дільниці № 850120 – 850122, 850131 –850135)
225;147119;98;Центр: місто Севастополь, Ленінський район;Нахімовський район з населеними пунктами Нахімовської районної у місті Севастополі ради, частина Ленінського району міста Севастополя (виборчі дільниці № 850088 – 850119, 850123 – 850130, 850136 – 850144)
