tvo;num_voters;num_stations;description;city_neighborhood
1;157732;94;Центр: місто Сімферополь, Центральний район;Залізничний район міста Сімферополя з населеними пунктами Залізничної районної в місті Сімферополі ради, Центральний район міста Сімферополя
2;146693;98;Центр: місто Сімферополь, Київський район;Київський район міста Сімферополя з населеними пунктами Київської районної в місті Сімферополі ради, частина Сімферопольського району (виборчі дільниці № 010583 – 010595, 010601 – 010603, 010631 –010637, 010647, 010648)
3;157096;164;Центр: місто Джанкой;місто Джанкой, Джанкойський, Красногвардійський райони
4;171077;136;Центр: місто Євпаторія;міста Євпаторія з населеними пунктами Євпаторійської міської ради, Саки, Сакський район
5;138219;98;Центр: місто Керч;місто Керч, частина Ленінського району (виборчі дільниці № 010346 – 010350, 010352 – 010356, 010358, 010360, 010362, 010363, 010365, 010366, 010370 – 010374, 010379, 010380, 010382 – 010384)
6;145125;107;Центр: місто Феодосія;місто Феодосія з населеними пунктами Феодосійської міської ради, Кіровський район, частина Ленінського району (виборчі дільниці № 010343, 010357, 010359, 010364, 010367 – 010369, 010375, 010376, 010378, 010386 – 010394)
7;143851;105;Центр: місто Ялта;міста Алушта, Ялта з населеними пунктами Алуштинської та Ялтинської міських рад
8;142955;154;Центр: смт Совєтський;місто Судак з населеними пунктами Судацької міської ради, Білогірський, Нижньогірський, Совєтський райони, частина Сімферопольського району (виборчі дільниці № 010608, 010609, 010612 –010614)
9;141638;151;Центр: смт Первомайське;міста Армянськ з населеними пунктами Армянської міської ради, Красноперекопськ, Красноперекопський, Первомайський, Роздольненський, Чорноморський райони
10;156729;130;Центр: місто Сімферополь;Бахчисарайський район, частина Сімферопольського району (виборчі дільниці № 010564 – 010582, 010596 – 010600, 010604 – 010607, 010610, 010611, 010615 – 010630, 010638 – 010646)
11;170236;112;Центр: місто Вінниця;частина міста Вінниці (виборчі дільниці № 051477 – 051547, 051575 – 051586), частина Вінницького району (виборчі дільниці № 050130 –050137, 050145, 050149, 050154 – 050156, 050161, 050162, 050164 – 050167, 050185 – 050192)
12;177067;115;Центр: місто Вінниця;частина міста Вінниці (виборчі дільниці № 051435 – 051476, 051548 – 051569, 051571 – 051574, 051587 – 051590, 051670), частина Вінницького району (виборчі дільниці № 050125 – 050129, 050138 – 050144, 050146 – 050148, 050150 – 050153, 050157 – 050160, 050163, 050168 – 050184)
13;152154;236;Центр: місто Калинівка;міста Козятин, Хмільник, Калинівський, Козятинський, Хмільницький райони
14;168048;271;Центр: місто Жмеринка;місто Жмеринка, Барський, Жмеринський, Літинський, Тиврівський райони
15;156448;215;Центр: місто Шаргород;Мурованокуриловецький, Томашпільський, Тульчинський, Чернівецький, Шаргородський райони
16;143871;197;Центр: місто Ямпіль;місто Могилів-Подільський, Крижопільський, Могилів-Подільський, Піщанський, Чечельницький, Ямпільський райони
17;165147;216;Центр: місто Ладижин;місто Ладижин, Бершадський, Гайсинський, Теплицький, Тростянецький райони
18;141977;298;Центр: місто Іллінці;Іллінецький, Липовецький, Немирівський, Оратівський, Погребищенський райони
19;144487;222;Центр: місто Володимир-Волинський;міста Володимир-Волинський, Нововолинськ, Володимир-Волинський, Іваничівський, Любомльський райони
20;157749;314;Центр: місто Горохів;Горохівський, Локачинський, Луцький, Рожищенський, Турійський райони
21;155723;249;Центр: місто Ковель;місто Ковель, Ковельський, Ратнівський, Старовижівський, Шацький райони
22;157536;84;Центр: місто Луцьк;місто Луцьк
23;160139;262;Центр: смт Маневичі;Камінь-Каширський, Ківерцівський, Любешівський, Маневицький райони
24;157681;86;Центр: місто Дніпропетровськ, Самарський район;Індустріальний район, частина Самарського району міста Дніпропетровська виборчі дільниці № 121444 – 121463, 121467 – 121479, 121481)
25;145409;81;Центр: місто Дніпропетровськ, Красногвардійський район;частина Амур-Нижньодніпровського району (виборчі дільниці № 121063, 121064, 121071 – 121077, 121084, 121087 – 121103), Красногвардійський район міста Дніпропетровська
26;143081;75;Центр: місто Дніпропетровськ, Бабушкінський район;Бабушкінський район, частина Кіровського району міста Дніпропетровська (виборчі дільниці № 121286 – 121291, 121293 – 121298, 121310 – 121315), смт Авіаторське Дніпропетровської міської ради
27;141932;86;Центр: місто Дніпропетровськ, Жовтневий район;Жовтневий район, частина Кіровського (виборчі дільниці № 121299 – 121309, 121316, 121317), частина Самарського (виборчі дільниці № 121464 – 121466, 121480) районів міста Дніпропетровська
28;146359;77;Центр: місто Дніпропетровськ, Ленінський район;Ленінський район міста Дніпропетровська, частина Амур-Нижньодніпровського району (виборчі дільниці № 121059 – 121062)
29;146039;86;Центр: Дніпропетровський район, смт Ювілейне;частина Амур-Нижньодніпровського району міста Дніпропетровська (виборчі дільниці № 121046 – 121058, 121065 – 121070, 121078 – 121083, 121085, 121086, 121104), Дніпропетровський, Петриківський райони
30;163910;83;Центр: місто Дніпродзержинськ, Заводський район;Баглійський, Дніпровський райони, частина Заводського району міста Дніпродзержинська (виборчі дільниці № 121012 – 121021, 121028, 121030, 121036 – 121038, 121040 – 121043)
31;172746;98;Центр: місто Кривий Ріг, Жовтневий район;Жовтневий район, частина Тернівського району міста Кривого Рогу (виборчі дільниці № 121694 – 121728, 121730 – 121733, 121780), селища Гірницьке, Коломійцеве, села Новоіванівка, Тернуватий Кут Криворізької міської ради
32;173835;92;Центр: місто Кривий Ріг, Довгинцівський район;Довгинцівський район, частина Саксаганського району (виборчі дільниці № 121638 – 121683, 121690 – 121693) міста Кривого Рогу
33;148177;88;Центр: місто Кривий Ріг, Центрально-Міський район;Дзержинський район, частина Інгулецького (виборчі дільниці № 121611 – 121619, 121636), частина Саксаганського (виборчі дільниці № 121684 – 121689) районів, Центрально-Міський район міста Кривого Рогу, селище Авангард Криворізької міської ради
34;156272;137;Центр: смт Царичанка;міста Вільногірськ, Жовті Води, Верхньодніпровський, П’ятихатський, Царичанський райони
35;168766;112;Центр: місто Нікополь;міста Нікополь, Орджонікідзе, Нікопольський район
36;157557;104;Центр: місто Павлоград;міста Павлоград, Першотравенськ, Тернівка, Павлоградський район
37;152887;146;Центр: місто Кривий Ріг;частина Інгулецького (виборчі дільниці № 121620 – 121635, 121637), частина Тернівського (виборча дільниця № 121729) районів міста Кривого Рогу, Апостолівський, Криворізький, Софіївський, Широківський райони
38;149013;137;Центр: місто Новомосковськ;місто Новомосковськ, Магдалинівський, Новомосковський, Юр’ївський райони
39;153188;157;Центр: смт Васильківка;місто Синельникове, Васильківський, Межівський, Петропавлівський, Покровський, Синельниківський райони
40;147371;129;Центр: смт Кринички;місто Марганець, частина Заводського району міста Дніпродзержинська (виборчі дільниці № 121022 – 121027, 121029, 121031 –121035, 121039, 121044, 121045), Криничанський, Солонянський, Томаківський райони
41;145618;88;Центр: місто Донецьк, Будьонівський район;Будьонівський, Пролетарський райони міста Донецька
42;139708;86;Центр: місто Донецьк, Ворошиловський район;Ворошиловський, Калінінський райони, частина Куйбишевського району міста Донецька (виборчі дільниці № 141833, 141836 – 141842)
43;152039;98;Центр: місто Донецьк, Ленінський район;Ленінський район, частина Кіровського (виборчі дільниці № 141805 – 141811), частина Куйбишевського (виборчі дільниці № 141827 –141832, 141834, 141835, 141843 – 141871, 141873, 141874) районів міста Донецька
44;156857;99;Центр: місто Донецьк, Кіровський район;Петровський район, частина Кіровського району міста Донецька (виборчі дільниці № 141763 – 141804, 141812 – 141826)
45;165208;110;Центр: місто Донецьк, Київський район;міста Авдіївка, Ясинувата, Київський район міста Донецька, Ясинуватський район
46;152665;153;Центр: місто Артемівськ;міста Артемівськ, Красний Лиман, Артемівський район
47;140858;113;Центр: місто Слов’янськ;місто Слов’янськ, Олександрівський, Слов’янський райони
48;152897;89;Центр: місто Краматорськ;місто Краматорськ
49;152298;128;Центр: місто Костянтинівка;міста Дружківка, Костянтинівка, Костянтинівський, Красноармійський райони
50;160664;116;Центр: місто Красноармійськ;міста Димитров, Добропілля, Красноармійськ, Добропільський район
51;143237;95;Центр: місто Горлівка, Центрально-Міський район;Микитівський, Центрально-Міський райони міста Горлівки
52;156353;109;Центр: місто Дзержинськ;міста Дебальцеве, Дзержинськ, Калінінський район міста Горлівки
53;166532;116;Центр: місто Єнакієве;міста Єнакієве, Торез
54;149091;123;Центр: місто Шахтарськ;міста Харцизьк, Шахтарськ, Шахтарський район
55;158098;121;Центр: місто Макіївка, Гірницький район;міста Жданівка, Кіровське, Гірницький, Совєтський райони міста Макіївки
56;160587;112;Центр: місто Макіївка, Центрально-Міський район;Кіровський, Червоногвардійський, Центрально-Міський райони міста Макіївки
57;166968;116;Центр: місто Маріуполь, Іллічівський район;Іллічівський, Орджонікідзевський райони міста Маріуполя
58;166899;99;Центр: місто Маріуполь, Жовтневий район;Жовтневий, Приморський райони міста Маріуполя
59;166314;155;Центр: місто Мар’їнка;міста Вугледар, Новогродівка, Селидове, Великоновосілківський, Мар’їнський райони
60;163417;161;Центр: місто Волноваха;Волноваський, Володарський, Новоазовський, Першотравневий, Тельманівський райони
61;146186;138;Центр: смт Старобешеве;міста Докучаєвськ, Сніжне, Амвросіївський, Старобешівський райони
62;171843;105;Центр: місто Житомир;частина Богунського району (виборчі дільниці № 181338 –181372, 181382 – 181386, 181388, 181389, 181399 – 181403), Корольовський район міста Житомира
63;165278;225;Центр: місто Бердичів;місто Бердичів, Андрушівський, Бердичівський, Попільнянський, Ружинський райони
64;164049;306;Центр: місто Коростень;місто Коростень, Коростенський, Лугинський, Овруцький, Олевський райони
65;156191;278;Центр: місто Новоград-Волинський;місто Новоград-Волинський, Баранівський, Ємільчинський, Новоград-Волинський, Червоноармійський райони
66;169367;298;Центр: місто Малин;місто Малин, Брусилівський, Володарсько-Волинський, Коростишівський, Малинський, Народицький, Радомишльський, Черняхівський райони
67;167444;248;Центр: місто Чуднів;частина Богунського району міста Житомира (виборчі дільниці № 181373 – 181381, 181387, 181390 – 181398), Житомирський, Любарський, Романівський, Чуднівський райони
68;154294;143;Центр: місто Ужгород;міста Ужгород, Чоп, Ужгородський район
69;158352;133;Центр: місто Мукачево;місто Мукачеве, частина Берегівського (виборчі дільниці № 210003 – 210005, 210012, 210013, 210015, 210017, 210019, 210021, 210029 – 210032, 210035), частина Іршавського (виборчі дільниці № 210172 –210180, 210203 – 210212, 210223 – 210228), частина Мукачівського (виборчі дільниці № 210303 – 210330, 210332 – 210339, 210343 – 210345, 210347 – 210365) районів
70;165311;211;Центр: місто Свалява;Великоберезнянський, Воловецький, Міжгірський, Перечинський, Свалявський райони, частина Мукачівського району (виборчі дільниці № 210278 – 210302, 210331, 210340 – 210342, 210346)
71;153967;103;Центр: місто Хуст;місто Хуст, Хустський район, частина Іршавського (виборчі дільниці № 210168 –210171, 210181 – 210183, 210185 – 210190, 210192 – 210195, 210198 – 210202), частина Тячівського (виборчі дільниці № 210479 –210481, 210504, 210516, 210522 – 210524, 210529, 210534, 210535, 210537, 210538) районів
72;173205;103;Центр: місто Тячів;Рахівський район, частина Тячівського району (виборчі дільниці № 210474 – 210478, 210482 – 210503, 210505 – 210515, 210517 – 210521, 210525 – 210528, 210530 – 210533, 210536, 210539 – 210547)
73;146913;114;Центр: місто Виноградів;місто Берегове, Виноградівський район, частина Берегівського (виборчі дільниці № 210001, 210002, 210006 – 210011, 210014, 210016, 210018, 210020, 210022 – 210028, 210033, 210034, 210036), частина Іршавського (виборчі дільниці № 210184, 210191, 210196, 210197, 210213 – 210222) районів
74;140199;74;Центр: місто Запоріжжя, Комунарський район;Комунарський район, частина Жовтневого району міста Запоріжжя (виборчі дільниці № 230811, 230814, 230820 – 230832, 230834 – 230836)
75;161477;80;Центр: місто Запоріжжя, Ленінський район;Заводський, Ленінський райони міста Запоріжжя
76;165579;90;Центр: місто Запоріжжя, Орджонікідзевський район;Орджонікідзевський, Хортицький райони міста Запоріжжя
77;141599;73;Центр: місто Запоріжжя, Шевченківський район;Шевченківський район, частина Жовтневого району міста Запоріжжя (виборчі дільниці № 230809, 230810, 230812, 230813, 230815 –230819)
78;159239;139;Центр: місто Бердянськ;місто Бердянськ з населеними пунктами Бердянської міської ради, Бердянський, Куйбишевський, Розівський, Чернігівський райони
79;174945;149;Центр: місто Василівка;місто Енергодар, Василівський, Великобілозерський, Кам’янсько-Дніпровський райони, частина Оріхівського району (виборчі дільниці № 230376 – 230386, 230388 – 230392, 230394 – 230399, 230401 –230406, 230408 – 230414)
80;164565;112;Центр: місто Мелітополь;місто Мелітополь, Мелітопольський район
81;164855;231;Центр: місто Токмак;місто Токмак, Веселівський, Михайлівський, Приазовський, Приморський, Токмацький, Якимівський райони
82;158044;176;Центр: місто Пологи;Гуляйпільський, Вільнянський, Запорізький, Новомиколаївський, Пологівський райони, частина Оріхівського району (виборчі дільниці № 230387, 230393, 230400, 230407)
83;163986;100;Центр: місто Івано-Франківськ;частина міста Івано-Франківська (виборчі дільниці № 260855 – 260884, 260887 – 260907, 260911 – 260917, 260919 – 260943, 260946 – 260960, 261040)
84;161917;192;Центр: місто Тисмениця;місто Бурштин, частина міста Івано-Франківська (виборчі дільниці № 260885, 260886, 260908 – 260910, 260918, 260944, 260945, 261037), Тисменицький, Тлумацький райони, частина Галицького району (виборчі дільниці № 260087 – 260089, 260099 – 260105, 260110 – 260129, 260131, 260132, 260134 – 260139, 260141 – 260153, 260155 – 260162, 260164, 261038)
85;141904;166;Центр: місто Калуш;місто Калуш, Калуський, Рогатинський райони, частина Галицького району (виборчі дільниці № 260106 – 260109, 260130, 260133, 260140, 260154)
86;147178;140;Центр: місто Долина;місто Болехів з населеними пунктами Болехівської міської ради, Долинський, Рожнятівський райони, частина Богородчанського району (виборчі дільниці № 260008, 260009, 260014, 260015, 260020 – 260023, 260027, 260034 – 260039, 260045, 260046)
87;147784;117;Центр: місто Надвірна;місто Яремче з населеними пунктами Яремчанської міської ради, Надвірнянський район, частина Богородчанського (виборчі дільниці № 260001 – 260007, 260010 – 260013, 260016 – 260019, 260024 – 260026, 260028 – 260033, 260040 – 260044), частина Коломийського (виборчі дільниці № 260329 – 260338, 260408) районів
88;158369;161;Центр: місто Коломия;місто Коломия, Городенківський район, частина Коломийського району (виборчі дільниці № 260339 – 260407, 260409 – 260411)
89;143162;159;Центр: місто Снятин;Верховинський, Косівський, Снятинський райони
90;157126;98;Центр: місто Біла Церква;місто Біла Церква
91;149227;165;Центр: смт Макарів;місто Фастів, Макарівський, Фастівський райони, частина Києво-Святошинського (виборчі дільниці № 320562, 320578 – 320582, 320597, 320598, 320607 – 320609, 320612 – 320614, 320617, 320618, 320624, 320628 – 320640, 320642), частина Сквирського (виборчі дільниці № 320872 –320874, 320878, 320879, 320883 – 320885, 320887 – 320889, 320893, 320894, 320896 – 320900, 320902, 320903) районів
92;152726;215;Центр: місто Узин;Білоцерківський, Володарський, Ставищенський, Таращанський, Тетіївський райони, частина Сквирського району (виборчі дільниці № 320862 – 320871, 320875 – 320877, 320880, 320881, 320886, 320890 – 320892, 320895, 320901, 320904 – 320909)
93;144040;181;Центр: місто Миронівка;міста Переяслав-Хмельницький, Ржищів, Богуславський, Кагарлицький, Миронівський, Рокитнянський райони
