tvo;num_voters;num_stations;description;city_neighborhood
94;150954;135;Центр: місто Обухів;міста Васильків, Обухів, Васильківський, Обухівський райони
95;166002;94;Центр: місто Ірпінь;місто Ірпінь, частина Києво-Святошинського району (виборчі дільниці № 320559 – 320561, 320563 – 320577, 320583 – 320596, 320599 – 320606, 320610, 320611, 320615, 320616, 320619 – 320623, 320625 – 320627, 320641, 320643, 320644, 321402 – 321406)
96;180546;196;Центр: місто Вишгород;міста Буча, Славутич, Бородянський, Вишгородський, Іванківський, Поліський райони
97;176559;135;Центр: місто Бровари;міста Березань, Бровари, Баришівський район, частина Броварського району (виборчі дільниці № 320226 – 320250, 320253 – 320272, 320276, 320277)
98;176346;184;Центр: місто Яготин;місто Бориспіль, Бориспільський, Згурівський, Переяслав-Хмельницький, Яготинський райони, частина Броварського району (виборчі дільниці № 320251, 320252, 320273 – 320275)
99;170245;111;Центр: місто Кіровоград, Ленінський район;частина Кіровського (виборчі дільниці № 350814 – 350869, 350874, 350875, 350882 – 350890), частина Ленінського (виборчі дільниці № 350894 – 350936) районів міста Кіровограда
100;152720;232;Центр: місто Бобринець;частина Кіровського (виборчі дільниці № 350876 – 350881), частина Ленінського (виборчі дільниці № 350892, 350893) районів міста Кіровограда, Бобринецький, Вільшанський, Добровеличківський, Кіровоградський, Компаніївський, Новоукраїнський райони, смт Нове Кіровоградської міської ради (виборчі дільниці № 350870 – 350873, 350891)
101;147876;203;Центр: смт Голованівськ;Гайворонський, Голованівський, Маловисківський, Новоархангельський, Новомиргородський, Ульяновський райони
102;148518;190;Центр: місто Знам’янка;міста Знам’янка, Світловодськ, Знам’янський, Новгородківський, Олександрівський, Онуфріївський, Світловодський райони
103;151805;187;Центр: місто Олександрія;місто Олександрія, Долинський, Олександрійський, Петрівський, Устинівський райони
104;172517;109;Центр: місто Луганськ, Артемівський район;Артемівський район, частина Кам’янобрідського району міста Луганська (виборчі дільниці № 441414 – 441418, 441433), частина Лутугинського району (виборчі дільниці № 440170 – 440178, 440186 – 440198, 440201 – 440203, 440206 – 440215)
105;167207;96;Центр: місто Луганськ, Жовтневий район;Жовтневий район, частина Кам’янобрідського району міста Луганська (виборчі дільниці № 441419 – 441432)
106;152282;108;Центр: місто Сєвєродонецьк;місто Сєвєродонецьк, частина міста Стаханова (виборчі дільниці № 441212 – 441232, 441249 – 441251, 441258 – 441260, 441262), частина Попаснянського району (виборчі дільниці № 440393 – 440421, 440424)
107;161732;92;Центр: місто Лисичанськ;місто Лисичанськ, частина міста Стаханова (виборчі дільниці № 441233 – 441248, 441252 – 441257), частина міста Первомайська (виборчі дільниці № 440975 – 440980, 440987, 440988), частина Попаснянського району (виборчі дільниці № 440381 – 440392, 440422, 440423)
108;151586;142;Центр: місто Красний Луч;місто Красний Луч, Перевальський район
109;162865;150;Центр: місто Краснодон;місто Краснодон, Ленінський район міста Луганська, Краснодонський район
110;169332;131;Центр: місто Алчевськ;міста Алчевськ, Антрацит, частина Антрацитівського (виборчі дільниці № 440009 – 440013, 440015 – 440020, 440028), частина Лутугинського (виборчі дільниці № 440179 – 440185, 440199, 440200, 440204, 440205) районів
111;164849;144;Центр: місто Свердловськ;міста Свердловськ, Ровеньки, частина Антрацитівського району (виборчі дільниці № 440001 – 440006, 440008, 440014, 440021 – 440027, 440029 – 440034)
112;151115;105;Центр: місто Рубіжне;міста Рубіжне, Кіровськ, Брянка, частина міста Первомайська (виборчі дільниці № 440981 – 440986, 440989 – 441003, 441005 – 441015)
113;153504;200;Центр: місто Сватове;Білокуракинський, Кремінський, Новоайдарський, Сватівський, Старобільський, Троїцький райони
114;149945;197;Центр: смт Станиця Луганська;Біловодський, Марківський, Міловський, Новопсковський, Слов’яносербський, Станично-Луганський райони
115;166644;94;Центр: місто Львів, Сихівський район;Сихівський район, частина Личаківського району міста Львова (виборчі дільниці № 461925 – 461928, 461931, 461935, 461936, 461940 – 461942, 461947 – 461950, 461954 – 461959, 461962 – 461975)
116;174834;80;Центр: місто Львів, Залізничний район;Залізничний район, частина Шевченківського району міста Львова (виборчі дільниці № 462109 – 462113, 462119 – 462129, 462137 – 462150, 462154)
117;168048;96;Центр: місто Львів, Франківський район;Галицький, Франківський райони, частина Шевченківського району міста Львова (виборчі дільниці № 462130 – 462136, 462153)
118;169758;137;Центр: місто Львів, Личаківський район;частина Личаківського (виборчі дільниці № 461929, 461930, 461932 – 461934, 461937 – 461939, 461943 – 461946, 461951 – 461953, 461960, 461961), частина Шевченківського (виборчі дільниці № 462095 – 462108, 462114 – 462118, 462151, 462152) районів міста Львова, Пустомитівський район
119;152557;248;Центр: місто Броди;Бродівський, Буський, Радехівський райони, частина Кам’янка-Бузького району (виборчі дільниці № 460614 – 460618, 460622, 460623, 460625 – 460643, 460649 – 460653, 460658, 460663, 460664, 460670 – 460679)
120;152875;247;Центр: місто Городок;Городоцький, Мостиський райони, частина Самбірського району (виборчі дільниці № 461059 – 461136, 461140 – 461147)
121;173199;142;Центр: місто Дрогобич;міста Борислав, Дрогобич, Трускавець, Дрогобицький район
122;175792;206;Центр: місто Яворів;Жовківський, Яворівський райони
123;155985;251;Центр: місто Перемишляни;місто Новий Розділ, Золочівський, Миколаївський, Перемишлянський райони
124;148096;157;Центр: місто Сокаль;місто Червоноград, Сокальський район, частина Кам’янка-Бузького району (виборчі дільниці № 460619 – 460621, 460624, 460644 –460648, 460654, 460656, 460657, 460659 – 460662, 460665 – 460669)
125;163041;261;Центр: місто Старий Самбір;місто Самбір, Сколівський, Старосамбірський, Турківський райони, частина Самбірського району (виборчі дільниці № 461137 – 461139)
126;151609;220;Центр: місто Стрий;міста Моршин, Стрий, Жидачівський, Стрийський райони
127;149767;126;Центр: місто Миколаїв, Заводський район;місто Очаків, Заводський район міста Миколаєва, Миколаївський, Очаківський райони
128;169216;91;Центр: місто Миколаїв, Ленінський район;Ленінський, Корабельний райони міста Миколаєва
129;146971;106;Центр: місто Миколаїв, Центральний район;Центральний район міста Миколаєва, Жовтневий район
130;144545;233;Центр: місто Баштанка;Баштанський, Березнегуватський, Казанківський, Новобузький, Новоодеський, Снігурівський райони
131;157945;190;Центр: місто Вознесенськ;міста Вознесенськ, Южноукраїнськ, Березанський, Веселинівський, Вознесенський, Доманівський, Єланецький райони
132;144049;184;Центр: місто Первомайськ;місто Первомайськ, Арбузинський, Братський, Врадіївський, Кривоозерський, Первомайський райони
133;173276;86;Центр: місто Одеса, Київський район;Київський район міста Одеси
134;171882;85;Центр: місто Одеса, Малиновський район;частина Малиновського району міста Одеси (виборчі дільниці № 511159 – 511218, 511220, 511222 – 511244)
135;176565;98;Центр: місто Одеса, Приморський район;Приморський район міста Одеси
136;177250;89;Центр: місто Одеса, Суворовський район;частина Малиновського (виборчі дільниці № 511219, 511221), частина Суворовського (виборчі дільниці № 511340 – 511365, 511374 – 511434) районів міста Одеси
137;139235;202;Центр: місто Котовськ;місто Котовськ, Балтський, Кодимський, Котовський, Красноокнянський, Савранський райони
138;150862;242;Центр: смт Ширяєве;Ананьївський, Березівський, Іванівський, Любашівський, Миколаївський, Ширяївський райони, частина Комінтернівського району (виборчі дільниці № 510473 – 510498, 510521, 510522)
139;172210;141;Центр: місто Роздільна;місто Южне, частина Суворовського району міста Одеси (виборчі дільниці № 511366 – 511373), Великомихайлівський, Роздільнянський, Фрунзівський райони, частина Біляївського (виборчі дільниці № 510222, 510223, 510230, 510237, 510238, 510241 – 510243, 510246, 510248, 510249, 510252, 510257, 510263 – 510265, 510268, 510269, 510276, 510277), частина Комінтернівського (виборчі дільниці № 510499 – 510520, 510523, 511443) районів
140;179688;111;Центр: місто Біляївка;міста Іллічівськ, Теплодар, Овідіопольський район, частина Біляївського району (виборчі дільниці № 510224 – 510229, 510231 – 510236, 510239, 510240, 510244, 510245, 510247, 510250, 510251, 510253 – 510256, 510258 – 510262, 510266, 510267, 510270 – 510275, 510278 – 510282)
141;154631;145;Центр: місто Татарбунари;місто Білгород-Дністровський, Білгород-Дністровський, Татарбунарський райони, частина Кілійського району (виборчі дільниці № 510407 – 510423, 510425 – 510428, 510431, 510435, 510439, 510440)
142;158840;154;Центр: місто Арциз;Арцизький, Саратський, Тарутинський райони, частина Болградського (виборчі дільниці № 510283 – 510290, 510296, 510298 –510315, 510317, 510318), частина Кілійського (виборчі дільниці № 510424, 510429, 510430, 510432 – 510434, 510436 – 510438) районів
143;143326;127;Центр: місто Ізмаїл;місто Ізмаїл, Ізмаїльський, Ренійський райони, частина Болградського району (виборчі дільниці № 510291 – 510295, 510297, 510316)
144;150038;85;Центр: місто Полтава, Октябрський район;Ленінський, Октябрський райони міста Полтави
145;152724;131;Центр: місто Полтава, Київський район;Київський район міста Полтави, Котелевський, Полтавський райони
146;144027;85;Центр: місто Кременчук;частина Автозаводського району (виборчі дільниці № 531040 –531085, 531099, 531100), Крюківський район міста Кременчука
147;142310;188;Центр: місто Миргород;місто Миргород, Диканський, Зіньківський, Миргородський, Решетилівський, Шишацький райони
148;150409;219;Центр: місто Лубни;місто Лубни, Великобагачанський, Оржицький, Семенівський, Хорольський райони, частина Лубенського району (виборчі дільниці № 530474 – 530494, 530504 – 530506, 530522 – 530531)
149;146270;216;Центр: місто Карлівка;Карлівський, Кобеляцький, Козельщинський, Машівський, Новосанжарський, Чутівський райони
150;147289;129;Центр: місто Комсомольськ;місто Комсомольськ, частина Автозаводського району міста Кременчука (виборчі дільниці № 531086 – 531098), Глобинський, Кременчуцький райони
151;143457;217;Центр: місто Лохвиця;Гадяцький, Гребінківський, Лохвицький, Пирятинський, Чорнухинський райони, частина Лубенського району (виборчі дільниці № 530495 – 530503, 530507 – 530521)
152;168327;95;Центр: місто Рівне;частина міста Рівного (виборчі дільниці № 560901 – 560913, 560915 – 560974, 560984 – 561004)
153;174638;230;Центр: місто Рівне;місто Острог, частина міста Рівного (виборчі дільниці № 560975 – 560983), Гощанський, Корецький, Острозький, Рівненський райони
154;178145;263;Центр: місто Дубно;місто Дубно, Демидівський, Дубенський, Здолбунівський, Млинівський, Радивилівський райони
155;174741;212;Центр: місто Дубровиця;місто Кузнецовськ, Володимирецький, Дубровицький, Зарічненський, Рокитнівський райони
156;169476;200;Центр: місто Сарни;Березнівський, Костопільський, Сарненський райони
157;173941;100;Центр: місто Суми;Ковпаківський район, частина Зарічного району міста Сум (виборчі дільниці № 590884 – 590895, 590926 – 590943, 591015), село Піщане Сумської міської ради з населеними пунктами Піщанської сільської ради
158;171436;190;Центр: місто Білопілля;частина Зарічного району міста Сум (виборчі дільниці № 590896 – 590925, 590944 – 590946), Білопільський, Краснопільський, Сумський райони
159;141390;223;Центр: місто Глухів;місто Глухів, Глухівський, Путивльський, Середино-Будський, Ямпільський райони, частина Кролевецького (виборчі дільниці № 590260 –590274, 590276 – 590278, 590280, 590282 – 590284, 590287, 590288, 590291, 590295 – 590299), частина Конотопського (виборчі дільниці № 590176, 590177, 590181 – 590183, 590185, 590186, 590188, 590190 – 590192, 590196 –590198, 590210, 590213), частина Шосткінського (виборчі дільниці № 590679 – 590688, 590694 – 590699) районів
160;142355;96;Центр: місто Шостка;міста Конотоп, Шостка, частина Конотопського (виборчі дільниці № 590179, 590180, 590200, 590207, 590208), частина Кролевецького (виборчі дільниці № 590275, 590279, 590281, 590285, 590286, 590289, 590290, 590292 – 590294), частина Шосткінського (виборчі дільниці № 590675 –590678, 590689 – 590693, 590700 – 590703) районів
161;143415;225;Центр: місто Ромни;місто Ромни, Буринський, Липоводолинський, Недригайлівський, Роменський райони, частина Конотопського району (виборчі дільниці № 590172 – 590175, 590178, 590184, 590187, 590189, 590193 – 590195, 590199, 590201 – 590206, 590209, 590211, 590212, 590214 –590218)
162;143213;171;Центр: місто Охтирка;міста Лебедин, Охтирка, Великописарівський, Лебединський, Охтирський, Тростянецький райони
163;172365;86;Центр: місто Тернопіль;частина міста Тернополя (виборчі дільниці № 611096 – 611181)
164;172620;307;Центр: місто Збараж;Збаразький, Лановецький, Підволочиський, Шумський райони, частина Кременецького району (виборчі дільниці № 610544 – 610552, 610554 – 610587, 610591, 610592, 610596 – 610604, 610607, 610609, 610610, 610613 – 610616)
165;175035;308;Центр: місто Зборів;частина міста Тернополя (виборчі дільниці № 611092 – 611095), Бережанський, Зборівський, Козівський, Підгаєцький, Тернопільський райони, частина Кременецького району (виборчі дільниці № 610542, 610543, 610553, 610588 – 610590, 610593 – 610595, 610605, 610606, 610608, 610611, 610612)
166;170390;271;Центр: місто Теребовля;Бучацький, Гусятинський, Монастириський, Теребовлянський райони
167;150664;211;Центр: місто Чортків;місто Чортків, Борщівський, Заліщицький, Чортківський райони
168;161085;88;Центр: місто Харків, Дзержинський район;Дзержинський район міста Харкова
169;162806;100;Центр: місто Харків, Київський район;Київський район, частина Московського району міста Харкова (виборчі дільниці № 631415 – 631421, 631481 – 631484, 631525 – 631527)
170;158650;82;Центр: місто Харків, Московський район;частина Московського району міста Харкова (виборчі дільниці № 631422 – 631446, 631451 – 631461, 631467 – 631480, 631485 – 631492, 631506 – 631524, 631528 – 631532)
171;154866;83;Центр: місто Харків, Фрунзенський район;Фрунзенський район, частина Комінтернівського (виборчі дільниці № 631354 – 631372), частина Орджонікідзевського (виборчі дільниці № 631533 – 631536) районів міста Харкова
172;157037;77;Центр: місто Харків, Орджонікідзевський район;частина Московського (виборчі дільниці № 631447 – 631450, 631462 – 631466, 631493 – 631505), частина Орджонікідзевського (виборчі дільниці № 631537 – 631590, 631692, 631693) районів міста Харкова
173;145954;81;Центр: місто Харків, Комінтернівський район;Червонозаводський район, частина Комінтернівського району міста Харкова (виборчі дільниці № 631316 – 631343, 631345 – 631353, 631373 – 631375, 631689)
174;154538;94;Центр: місто Харків, Ленінський район;Жовтневий, Ленінський райони міста Харкова
175;145993;112;Центр: місто Дергачі;місто Люботин, Дергачівський район, частина Харківського району (виборчі дільниці № 630810 – 630813, 630817 – 630819, 630829 – 630831, 630833 – 630836, 630840 – 630844, 630848 – 630859, 630874 – 630879, 630881)
176;146422;157;Центр: місто Чугуїв;місто Чугуїв, Великобурлуцький, Вовчанський, Дворічанський, Печенізький, Чугуївський райони
177;154095;167;Центр: місто Куп’янськ;міста Ізюм, Куп’янськ, Борівський, Ізюмський, Куп’янський, Шевченківський райони
178;142538;162;Центр: місто Балаклія;місто Первомайський, Балаклійський, Барвінківський, Близнюківський, Первомайський райони
179;156907;192;Центр: місто Красноград;місто Лозова, Зачепилівський, Кегичівський, Красноградський, Лозівський, Сахновщинський райони
180;142281;181;Центр: смт Золочів;Богодухівський, Валківський, Золочівський, Коломацький, Краснокутський, Нововодолазький райони, частина Харківського району (виборчі дільниці № 630820 – 630822)
181;156530;108;Центр: місто Зміїв;Зміївський район, частина Харківського району (виборчі дільниці № 630779 – 630809, 630823 – 630828, 630832, 630837 – 630839, 630846, 630847, 630860 – 630873, 630880, 630882, 630883)
